{
  "schema": 1,
  "generatedAt": "2026-10-22T10:00:00Z",
  "channels": {
    "stable": "0.0.0"
  },
  "releases": {
    "0.0.0": {
      "status": "supported",
      "flutter": {
        "baseline": "3.47.4"
      },
      "dart": ">=3.13.0 <4.0.0",
      "shell": {
        "url": "https://github.com/Aqutter/aqutter.git",
        "path": "shell",
        "ref": "2c68ba5ed66a37629d99ef30b6dd2eb7f49adb31"
      },
      "core": {
        "url": "https://github.com/Aqutter/aqutter_core.git",
        "ref": "f90eb6b8cabb9b2177148fd4e2662b93daa90cc9"
      },
      "client": {
        "spec": "github:Aqutter/aqutter-js#22840cd46fb1abae31fa50411646e96918bda354"
      },
      "cli": {
        "min": "0.0.0"
      }
    }
  }
}
